{
  "id": "condition:phb:exhaustion",
  "name": "Exhaustion",
  "sourceMetadata": {
    "source": "PHB",
    "page": 291,
    "flags": {
      "srd": true,
      "basicRules": true
    },
    "reprintedAs": [
      {
        "targetType": "condition",
        "id": "condition:xphb:exhaustion"
      }
    ]
  },
  "levelMechanics": {
    "maximumLevel": 6,
    "cumulative": true,
    "application": "add-specified-levels",
    "endsAtLevel": 0,
    "recovery": [
      {
        "method": "long-rest",
        "levelsRemoved": 1,
        "requirements": [
          "food",
          "drink"
        ]
      },
      {
        "method": "raised-from-dead",
        "levelsRemoved": 1
      }
    ]
  },
  "effects": [
    {
      "kind": "CHECK_ROLL_MODIFIER",
      "roll": "ability-check",
      "direction": "disadvantage",
      "actor": "affected-creature",
      "duration": "while-level-threshold-is-met",
      "minimumLevel": 1
    },
    {
      "kind": "RESTRICTION",
      "restriction": "movement-limited",
      "actor": "affected-creature",
      "appliesWhen": "at-or-above-level",
      "minimumLevel": 2,
      "amount": 0.5,
      "unit": "speed-fraction",
      "duration": "while-level-threshold-is-met"
    },
    {
      "kind": "CHECK_ROLL_MODIFIER",
      "roll": "attack",
      "direction": "disadvantage",
      "actor": "affected-creature",
      "duration": "while-level-threshold-is-met",
      "minimumLevel": 3
    },
    {
      "kind": "CHECK_ROLL_MODIFIER",
      "roll": "saving-throw",
      "direction": "disadvantage",
      "actor": "affected-creature",
      "duration": "while-level-threshold-is-met",
      "minimumLevel": 3
    },
    {
      "kind": "HIT_POINT_MAX_MODIFIER",
      "fraction": 0.5,
      "minimumLevel": 4,
      "actor": "affected-creature",
      "appliesWhen": "at-or-above-level",
      "duration": {
        "kind": "while-condition-level-at-or-above",
        "level": 4
      }
    },
    {
      "kind": "MOVEMENT_MODIFIER",
      "movement": "speed-flat",
      "actor": "affected-creature",
      "amount": 0,
      "duration": "while-level-threshold-is-met",
      "minimumLevel": 5
    },
    {
      "kind": "FATAL_EXHAUSTION_THRESHOLD",
      "atLevel": 6
    }
  ]
}
