{
  "id": "condition:phb:blinded",
  "name": "Blinded",
  "sourceMetadata": {
    "source": "PHB",
    "page": 290,
    "flags": {
      "srd": true,
      "basicRules": true
    },
    "citations": [
      {
        "source": "RMR",
        "page": 62
      }
    ],
    "reprintedAs": [
      {
        "targetType": "condition",
        "id": "condition:xphb:blinded"
      }
    ]
  },
  "effects": [
    {
      "kind": "REMOVE_SENSE",
      "sense": "sight",
      "actor": "affected-creature"
    },
    {
      "kind": "AUTOMATIC_CHECK_FAILURE",
      "roll": "ability-check",
      "requirement": "requires-sight",
      "actor": "affected-creature"
    },
    {
      "kind": "ATTACK_ROLL_MODIFIER",
      "roll": "attack",
      "direction": "advantage",
      "actor": "attacker",
      "target": "affected-creature",
      "appliesWhen": "attack-targets-affected"
    },
    {
      "kind": "ATTACK_ROLL_MODIFIER",
      "roll": "attack",
      "direction": "disadvantage",
      "actor": "affected-creature",
      "target": "target",
      "appliesWhen": "affected-creature-attacks"
    }
  ]
}
